{
  "$schema": "https://json-schema.org/draft/2020-12/schema",
  "title": "LLM Wiki Run Ledger",
  "type": "object",
  "additionalProperties": false,
  "required": [
    "run_id",
    "status",
    "events"
  ],
  "$defs": {
    "metadata_property": {
      "type": "object",
      "additionalProperties": false,
      "required": [
        "name",
        "value"
      ],
      "properties": {
        "name": {
          "type": "string",
          "minLength": 1
        },
        "value": {
          "type": "string"
        }
      }
    },
    "metadata": {
      "type": "object",
      "additionalProperties": false,
      "required": [
        "properties"
      ],
      "properties": {
        "properties": {
          "type": "array",
          "items": {
            "$ref": "#/$defs/metadata_property"
          }
        }
      }
    },
    "event": {
      "type": "object",
      "additionalProperties": false,
      "required": [
        "ts",
        "type",
        "summary",
        "artifacts",
        "decision"
      ],
      "properties": {
        "ts": {
          "type": "string",
          "pattern": "^\\d{4}-\\d{2}-\\d{2}T\\d{2}:\\d{2}:\\d{2}Z$"
        },
        "type": {
          "type": "string",
          "enum": [
            "created",
            "seed_frozen",
            "baseline_captured",
            "mutation_applied",
            "mutation_failed",
            "generated_artifact_convergence_checked",
            "candidate_captured",
            "scope_frozen",
            "subagent_routed",
            "executor_completed",
            "review_blocked",
            "validation_blocked",
            "worker_repo_health_preflight_checked",
            "same_session_repair_attempt_scheduled",
            "workspace_apply_canary_ready",
            "workspace_rollback_rehearsed",
            "workspace_applied",
            "repo_health_checked",
            "promotion_evaluated",
            "history_status_updated",
            "finalized"
          ]
        },
        "summary": {
          "type": "string",
          "minLength": 1
        },
        "artifacts": {
          "type": "array",
          "minItems": 1,
          "items": {
            "type": "string",
            "minLength": 1
          }
        },
        "decision": {
          "type": "string"
        },
        "decision_event": {
          "$ref": "#/$defs/decision_event"
        }
      }
    },
    "decision_event": {
      "type": "object",
      "additionalProperties": false,
      "required": [
        "decision_id",
        "decision",
        "reason_code",
        "policy_version",
        "source_rule",
        "source_pass",
        "effective_at",
        "ledger_event_type"
      ],
      "properties": {
        "decision_id": {
          "type": "string",
          "minLength": 1
        },
        "decision": {
          "type": "string",
          "enum": [
            "PROMOTE",
            "HOLD",
            "DISCARD"
          ]
        },
        "reason_code": {
          "type": "string"
        },
        "policy_version": {
          "type": "integer",
          "minimum": 0
        },
        "source_rule": {
          "type": "string"
        },
        "source_pass": {
          "type": "string"
        },
        "effective_at": {
          "type": "string"
        },
        "ledger_event_type": {
          "type": "string"
        }
      }
    }
  },
  "properties": {
    "$schema": {
      "type": "string"
    },
    "run_id": {
      "type": "string",
      "minLength": 1
    },
    "status": {
      "enum": [
        "draft",
        "running",
        "ready",
        "blocked",
        "complete"
      ]
    },
    "events": {
      "type": "array",
      "minItems": 1,
      "items": {
        "$ref": "#/$defs/event"
      }
    },
    "metadata": {
      "$ref": "#/$defs/metadata"
    }
  },
  "allOf": [
    {
      "if": {
        "properties": {
          "status": {
            "const": "draft"
          }
        }
      },
      "then": {
        "properties": {
          "events": {
            "contains": {
              "type": "object",
              "properties": {
                "type": {
                  "const": "created"
                }
              }
            }
          }
        }
      }
    },
    {
      "if": {
        "properties": {
          "status": {
            "const": "running"
          }
        }
      },
      "then": {
        "properties": {
          "events": {
            "contains": {
              "type": "object",
              "properties": {
                "type": {
                  "const": "seed_frozen"
                }
              }
            }
          }
        }
      }
    },
    {
      "if": {
        "properties": {
          "status": {
            "const": "ready"
          }
        }
      },
      "then": {
        "properties": {
          "events": {
            "contains": {
              "type": "object",
              "properties": {
                "type": {
                  "const": "promotion_evaluated"
                }
              }
            }
          }
        }
      }
    },
    {
      "if": {
        "properties": {
          "status": {
            "const": "complete"
          }
        }
      },
      "then": {
        "properties": {
          "events": {
            "allOf": [
              {
                "contains": {
                  "type": "object",
                  "properties": {
                    "type": {
                      "const": "promotion_evaluated"
                    }
                  }
                }
              },
              {
                "contains": {
                  "type": "object",
                  "properties": {
                    "type": {
                      "const": "finalized"
                    }
                  }
                }
              }
            ]
          }
        }
      }
    }
  ]
}
