{
  "$schema": "ops/schemas/run-ledger.schema.json",
  "run_id": "run-20260507-auto-improve-existing-telemetry-inline-same-eval-replacement",
  "status": "ready",
  "events": [
    {
      "ts": "2026-05-06T19:49:37Z",
      "type": "created",
      "summary": "Initialized mechanism experiment artifacts from the mechanism-run starter bundle.",
      "artifacts": [
        "seed.yaml",
        "planning-validation.json",
        "run-ledger.json",
        "improvement-observations.json",
        "proposal-snapshot.json",
        "promotion-report.json",
        "plan.md",
        "open-questions.md",
        "baseline-eval.json",
        "candidate-eval.json",
        "baseline-lint.json",
        "candidate-lint.json",
        "baseline-mechanism-assessment.json",
        "candidate-mechanism-assessment.json",
        "changed-files-manifest.json"
      ],
      "decision": ""
    },
    {
      "ts": "2026-05-06T19:49:37Z",
      "type": "seed_frozen",
      "summary": "Frozen mechanism scope to primary target ops/scripts/auto_improve_iteration_persistence_runtime.py and prepared wrapper-driven execution.",
      "artifacts": [
        "runs/run-20260507-auto-improve-existing-telemetry-inline-same-eval-replacement/seed.yaml",
        "runs/run-20260507-auto-improve-existing-telemetry-inline-same-eval-replacement/plan.md",
        "runs/run-20260507-auto-improve-existing-telemetry-inline-same-eval-replacement/improvement-observations.json",
        "runs/run-20260507-auto-improve-existing-telemetry-inline-same-eval-replacement/promotion-report.json"
      ],
      "decision": "ready_for_baseline_capture"
    },
    {
      "ts": "2026-05-06T19:49:39Z",
      "type": "baseline_captured",
      "summary": "Captured baseline lint, eval, and mechanism assessment artifacts.",
      "artifacts": [
        "ops/scripts/auto_improve_iteration_persistence_runtime.py",
        "ops/schemas/run-telemetry.schema.json",
        "tests/test_auto_improve_iteration_runtime.py",
        "runs/run-20260507-auto-improve-existing-telemetry-inline-same-eval-replacement/baseline-lint.json",
        "runs/run-20260507-auto-improve-existing-telemetry-inline-same-eval-replacement/baseline-eval.json",
        "runs/run-20260507-auto-improve-existing-telemetry-inline-same-eval-replacement/baseline-mechanism-assessment.json"
      ],
      "decision": "baseline_ready"
    },
    {
      "ts": "2026-05-06T19:49:40Z",
      "type": "mutation_applied",
      "summary": "Applied the wrapper-provided mutation command inside a disposable workspace.",
      "artifacts": [
        "ops/scripts/auto_improve_iteration_persistence_runtime.py",
        "ops/schemas/run-telemetry.schema.json",
        "tests/test_auto_improve_iteration_runtime.py",
        "runs/run-20260507-auto-improve-existing-telemetry-inline-same-eval-replacement/mutation-command.stdout.txt",
        "runs/run-20260507-auto-improve-existing-telemetry-inline-same-eval-replacement/mutation-command.stderr.txt"
      ],
      "decision": "candidate_ready_for_capture"
    },
    {
      "ts": "2026-05-06T19:49:42Z",
      "type": "candidate_captured",
      "summary": "Captured candidate lint, eval, and mechanism assessment artifacts from the disposable workspace.",
      "artifacts": [
        "ops/scripts/auto_improve_iteration_persistence_runtime.py",
        "ops/schemas/run-telemetry.schema.json",
        "tests/test_auto_improve_iteration_runtime.py",
        "runs/run-20260507-auto-improve-existing-telemetry-inline-same-eval-replacement/candidate-lint.json",
        "runs/run-20260507-auto-improve-existing-telemetry-inline-same-eval-replacement/candidate-eval.json",
        "runs/run-20260507-auto-improve-existing-telemetry-inline-same-eval-replacement/candidate-mechanism-assessment.json"
      ],
      "decision": "ready_for_repo_health_gate"
    },
    {
      "ts": "2026-05-06T19:49:43Z",
      "type": "repo_health_checked",
      "summary": "Repo health command passed before promotion evaluation.",
      "artifacts": [
        "runs/run-20260507-auto-improve-existing-telemetry-inline-same-eval-replacement/repo-health.stdout.txt",
        "runs/run-20260507-auto-improve-existing-telemetry-inline-same-eval-replacement/repo-health.stderr.txt",
        "runs/run-20260507-auto-improve-existing-telemetry-inline-same-eval-replacement/changed-files-manifest.json",
        "runs/run-20260507-auto-improve-existing-telemetry-inline-same-eval-replacement/behavior-delta.json"
      ],
      "decision": "repo_health_pass"
    },
    {
      "ts": "2026-05-06T19:49:44Z",
      "type": "workspace_apply_canary_ready",
      "summary": "Prepared workspace changes as a canary-only apply plan; live repository was not mutated.",
      "artifacts": [
        "runs/run-20260507-auto-improve-existing-telemetry-inline-same-eval-replacement/changed-files-manifest.json",
        "runs/run-20260507-auto-improve-existing-telemetry-inline-same-eval-replacement/shadow-apply-report.json"
      ],
      "decision": "PROMOTE"
    },
    {
      "ts": "2026-05-06T19:49:44Z",
      "type": "promotion_evaluated",
      "summary": "Promotion gate returned PROMOTE for this mechanism run.",
      "artifacts": [
        "ops/scripts/auto_improve_iteration_persistence_runtime.py",
        "ops/schemas/run-telemetry.schema.json",
        "runs/run-20260507-auto-improve-existing-telemetry-inline-same-eval-replacement/baseline-lint.json",
        "runs/run-20260507-auto-improve-existing-telemetry-inline-same-eval-replacement/baseline-eval.json",
        "runs/run-20260507-auto-improve-existing-telemetry-inline-same-eval-replacement/baseline-mechanism-assessment.json",
        "runs/run-20260507-auto-improve-existing-telemetry-inline-same-eval-replacement/candidate-lint.json",
        "runs/run-20260507-auto-improve-existing-telemetry-inline-same-eval-replacement/candidate-eval.json",
        "runs/run-20260507-auto-improve-existing-telemetry-inline-same-eval-replacement/candidate-mechanism-assessment.json",
        "runs/run-20260507-auto-improve-existing-telemetry-inline-same-eval-replacement/changed-files-manifest.json",
        "runs/run-20260507-auto-improve-existing-telemetry-inline-same-eval-replacement/behavior-delta.json",
        "runs/run-20260507-auto-improve-existing-telemetry-inline-same-eval-replacement/improvement-observations.json",
        "runs/run-20260507-auto-improve-existing-telemetry-inline-same-eval-replacement/promotion-report.json"
      ],
      "decision": "PROMOTE",
      "decision_event": {
        "decision_id": "decision:run-20260507-auto-improve-existing-telemetry-inline-same-eval-replacement:b527606b449e48b7",
        "decision": "PROMOTE",
        "reason_code": "no_blocking_rule_triggered",
        "policy_version": 4,
        "source_rule": "default_promote",
        "source_pass": "system_mechanism",
        "effective_at": "2026-05-06T19:49:44Z",
        "ledger_event_type": "promotion_evaluated"
      }
    }
  ],
  "metadata": {
    "properties": [
      {
        "name": "urn:openai:archived-run-backfill",
        "value": "{\"archive_reason\": \"run_artifact_embedded_envelope_backfill\", \"envelope_mode\": \"metadata.properties\", \"generated_at\": \"2026-05-06T19:49:44Z\", \"generated_at_source\": \"events[6].ts\", \"helper\": \"ops.scripts.backfill_archived_run_artifacts\", \"normalized_at\": \"2026-05-06T19:58:37Z\", \"source_artifact\": \"runs/run-20260507-auto-improve-existing-telemetry-inline-same-eval-replacement/run-ledger.json\"}"
      },
      {
        "name": "urn:openai:artifact-envelope",
        "value": "{\"$schema\": \"ops/schemas/run-ledger.schema.json\", \"artifact_kind\": \"run_ledger\", \"artifact_status\": \"archived\", \"currentness\": {\"checked_at\": \"2026-05-06T19:58:37Z\", \"status\": \"current\"}, \"encoding\": \"utf-8\", \"generated_at\": \"2026-05-06T19:49:44Z\", \"input_fingerprints\": {\"archived_run_payload_before_backfill\": \"bbdb1e8b4733c46c937f29c1904b4c793c1b947a014c7eda16d7a435c3155bc6\", \"artifact_envelope_schema\": \"87fcb7b91ffc04e8180c1c3e51e309cde186ecf23f91f7974a541d0b580976de\", \"envelope_mode\": \"f9416f4de9dee1f94a28cfe3816ddf91a55b45560a990e9279c2582a6cf47e35\", \"generated_at_source\": \"9ddae749bc6d64f1e610e606196aaf7f474eb6d62987bb9f8464728fe5c9c61a\", \"policy\": \"606ba1235550f640f7365d46d76aa52b84ef8f831502790010a6c776a7b721d1\", \"schema\": \"c2cdb143ffa3afc0cc2983aceb7602caf13232ca806c6e02d3adfc4ce951c85a\", \"target_rel_path\": \"9aaf779747afdcdabfe3847ba2c3087a0ccc73c7c621c3663f5af97c4e3e4c2f\"}, \"producer\": \"ops.scripts.backfill_archived_run_artifacts\", \"retention_policy\": \"archive\", \"schema_version\": 1, \"source_command\": \"python -m ops.scripts.backfill_archived_run_artifacts --vault . --path runs/run-20260507-auto-improve-existing-telemetry-inline-same-eval-replacement/run-ledger.json\", \"source_revision\": \"unknown\", \"source_tree_fingerprint\": \"1c4078849302f6b54e4eb36b8d169b09ac7d3e7592d883a1170caf453b2b4219\"}"
      }
    ]
  }
}
