{
  "$schema": "ops/schemas/run-ledger.schema.json",
  "run_id": "auto-improve-2026-05-02t03-27-31z-run-01-auto-improve-iteration-persistence-runtime",
  "status": "draft",
  "events": [
    {
      "ts": "2026-05-02T03:27:34Z",
      "type": "created",
      "summary": "Initialized mechanism experiment artifacts from the mechanism-run starter bundle.",
      "artifacts": [
        "seed.yaml",
        "planning-validation.json",
        "run-ledger.json",
        "improvement-observations.json",
        "proposal-snapshot.json",
        "promotion-report.json",
        "plan.md",
        "open-questions.md",
        "baseline-eval.json",
        "candidate-eval.json",
        "baseline-lint.json",
        "candidate-lint.json",
        "baseline-mechanism-assessment.json",
        "candidate-mechanism-assessment.json",
        "changed-files-manifest.json"
      ],
      "decision": ""
    },
    {
      "ts": "2026-05-02T03:27:34Z",
      "type": "scope_frozen",
      "summary": "Frozen proposal scope for automated execution.",
      "artifacts": [
        "runs/auto-improve-2026-05-02t03-27-31z-run-01-auto-improve-iteration-persistence-runtime/scope-freeze.json"
      ],
      "decision": "blocked"
    },
    {
      "ts": "2026-05-02T03:27:34Z",
      "type": "subagent_routed",
      "summary": "Selected bounded subagent roles and ladder rungs for this run.",
      "artifacts": [
        "runs/auto-improve-2026-05-02t03-27-31z-run-01-auto-improve-iteration-persistence-runtime/subagent-routing.worker.json",
        "runs/auto-improve-2026-05-02t03-27-31z-run-01-auto-improve-iteration-persistence-runtime/subagent-routing.reviewer.json",
        "runs/auto-improve-2026-05-02t03-27-31z-run-01-auto-improve-iteration-persistence-runtime/subagent-routing.provenance-auditor.json"
      ],
      "decision": "ready"
    }
  ],
  "metadata": {
    "properties": [
      {
        "name": "urn:openai:archived-run-backfill",
        "value": "{\"archive_reason\": \"run_artifact_embedded_envelope_backfill\", \"envelope_mode\": \"metadata.properties\", \"generated_at\": \"2026-05-02T03:27:34Z\", \"generated_at_source\": \"events[0].ts\", \"helper\": \"ops.scripts.backfill_archived_run_artifacts\", \"normalized_at\": \"2026-05-02T05:45:04Z\", \"source_artifact\": \"runs/archive/auto-improve-2026-05-02t03-27-31z-run-01-auto-improve-iteration-persistence-runtime/run-ledger.json\"}"
      },
      {
        "name": "urn:openai:artifact-envelope",
        "value": "{\"$schema\": \"ops/schemas/run-ledger.schema.json\", \"artifact_kind\": \"run_ledger\", \"artifact_status\": \"archived\", \"currentness\": {\"checked_at\": \"2026-05-02T05:45:04Z\", \"status\": \"current\"}, \"encoding\": \"utf-8\", \"generated_at\": \"2026-05-02T03:27:34Z\", \"input_fingerprints\": {\"archived_run_payload_before_backfill\": \"f85a2c61db892bccd902c95d2d3adc1b93e7ed2ce351a04ca6c97e1fecc244ee\", \"artifact_envelope_schema\": \"87fcb7b91ffc04e8180c1c3e51e309cde186ecf23f91f7974a541d0b580976de\", \"envelope_mode\": \"f9416f4de9dee1f94a28cfe3816ddf91a55b45560a990e9279c2582a6cf47e35\", \"generated_at_source\": \"7fd635c4243df9d8ec243a1c876a4b9aeab6bf888e21d99ace784d565fd322bb\", \"policy\": \"7d45acc617992bca127ce0b7defb6715caac5b774dcc489acf984502cea3a402\", \"schema\": \"c2cdb143ffa3afc0cc2983aceb7602caf13232ca806c6e02d3adfc4ce951c85a\", \"target_rel_path\": \"f0d5302d46d6923b408c16980ba4a8c530020afdc81a7bb1b4d9a5b1cd120857\"}, \"producer\": \"ops.scripts.backfill_archived_run_artifacts\", \"retention_policy\": \"archive\", \"schema_version\": 1, \"source_command\": \"python -m ops.scripts.backfill_archived_run_artifacts --vault . --path runs/archive/auto-improve-2026-05-02t03-27-31z-run-01-auto-improve-iteration-persistence-runtime/run-ledger.json\", \"source_revision\": \"unknown\", \"source_tree_fingerprint\": \"41b1839ac149b5f321b5037bbd5caf4b174d61ce791ec1182e0daa57534d5c06\"}"
      }
    ]
  }
}
