{
  "$schema": "ops/schemas/run-ledger.schema.json",
  "run_id": "run-20260422-auto-improve-timeout-telemetry-fallback",
  "status": "complete",
  "events": [
    {
      "ts": "2026-04-22T12:46:39Z",
      "type": "created",
      "summary": "Initialized mechanism experiment artifacts from the mechanism-run starter bundle.",
      "artifacts": [
        "seed.yaml",
        "planning-validation.json",
        "run-ledger.json",
        "improvement-observations.json",
        "promotion-report.json",
        "plan.md",
        "open-questions.md",
        "baseline-eval.json",
        "candidate-eval.json",
        "baseline-lint.json",
        "candidate-lint.json",
        "baseline-mechanism-assessment.json",
        "candidate-mechanism-assessment.json",
        "changed-files-manifest.json"
      ],
      "decision": ""
    },
    {
      "ts": "2026-04-22T12:46:39Z",
      "type": "seed_frozen",
      "summary": "Frozen mechanism scope to primary target ops/scripts/auto_improve_iteration_persistence_runtime.py and prepared wrapper-driven execution.",
      "artifacts": [
        "runs/run-20260422-auto-improve-timeout-telemetry-fallback/seed.yaml",
        "runs/run-20260422-auto-improve-timeout-telemetry-fallback/plan.md",
        "runs/run-20260422-auto-improve-timeout-telemetry-fallback/improvement-observations.json",
        "runs/run-20260422-auto-improve-timeout-telemetry-fallback/promotion-report.json"
      ],
      "decision": "ready_for_baseline_capture"
    },
    {
      "ts": "2026-04-22T12:48:02Z",
      "type": "baseline_captured",
      "summary": "Captured baseline lint, eval, and mechanism assessment artifacts.",
      "artifacts": [
        "ops/scripts/auto_improve_iteration_persistence_runtime.py",
        "ops/schemas/run-telemetry.schema.json",
        "tests/test_auto_improve_iteration_runtime.py",
        "runs/run-20260422-auto-improve-timeout-telemetry-fallback/baseline-lint.json",
        "runs/run-20260422-auto-improve-timeout-telemetry-fallback/baseline-eval.json",
        "runs/run-20260422-auto-improve-timeout-telemetry-fallback/baseline-mechanism-assessment.json"
      ],
      "decision": "baseline_ready"
    },
    {
      "ts": "2026-04-22T12:49:47Z",
      "type": "mutation_applied",
      "summary": "Applied the wrapper-provided mutation command inside a disposable workspace.",
      "artifacts": [
        "ops/scripts/auto_improve_iteration_persistence_runtime.py",
        "ops/schemas/run-telemetry.schema.json",
        "tests/test_auto_improve_iteration_runtime.py",
        "runs/run-20260422-auto-improve-timeout-telemetry-fallback/mutation-command.stdout.txt",
        "runs/run-20260422-auto-improve-timeout-telemetry-fallback/mutation-command.stderr.txt"
      ],
      "decision": "candidate_ready_for_capture"
    },
    {
      "ts": "2026-04-22T12:54:55Z",
      "type": "candidate_captured",
      "summary": "Captured candidate lint, eval, and mechanism assessment artifacts from the disposable workspace.",
      "artifacts": [
        "ops/scripts/auto_improve_iteration_persistence_runtime.py",
        "ops/schemas/run-telemetry.schema.json",
        "tests/test_auto_improve_iteration_runtime.py",
        "runs/run-20260422-auto-improve-timeout-telemetry-fallback/candidate-lint.json",
        "runs/run-20260422-auto-improve-timeout-telemetry-fallback/candidate-eval.json",
        "runs/run-20260422-auto-improve-timeout-telemetry-fallback/candidate-mechanism-assessment.json"
      ],
      "decision": "ready_for_repo_health_gate"
    },
    {
      "ts": "2026-04-22T12:55:30Z",
      "type": "repo_health_checked",
      "summary": "Repo health command passed before promotion evaluation.",
      "artifacts": [
        "runs/run-20260422-auto-improve-timeout-telemetry-fallback/repo-health.stdout.txt",
        "runs/run-20260422-auto-improve-timeout-telemetry-fallback/repo-health.stderr.txt",
        "runs/run-20260422-auto-improve-timeout-telemetry-fallback/changed-files-manifest.json",
        "runs/run-20260422-auto-improve-timeout-telemetry-fallback/behavior-delta.json"
      ],
      "decision": "repo_health_pass"
    },
    {
      "ts": "2026-04-22T12:55:32Z",
      "type": "workspace_rollback_rehearsed",
      "summary": "Rehearsed workspace apply and rollback before mutating the live repository.",
      "artifacts": [
        "runs/run-20260422-auto-improve-timeout-telemetry-fallback/changed-files-manifest.json",
        "runs/run-20260422-auto-improve-timeout-telemetry-fallback/shadow-apply-report.json",
        "runs/run-20260422-auto-improve-timeout-telemetry-fallback/rollback-rehearsal-report.json"
      ],
      "decision": "PROMOTE"
    },
    {
      "ts": "2026-04-22T12:55:33Z",
      "type": "workspace_applied",
      "summary": "Applied workspace changes to the live repository after promotion.",
      "artifacts": [
        "runs/run-20260422-auto-improve-timeout-telemetry-fallback/changed-files-manifest.json",
        "runs/run-20260422-auto-improve-timeout-telemetry-fallback/shadow-apply-report.json",
        "runs/run-20260422-auto-improve-timeout-telemetry-fallback/rollback-rehearsal-report.json"
      ],
      "decision": "PROMOTE"
    },
    {
      "ts": "2026-04-22T12:55:33Z",
      "type": "promotion_evaluated",
      "summary": "Promotion gate returned PROMOTE for this mechanism run.",
      "artifacts": [
        "ops/scripts/auto_improve_iteration_persistence_runtime.py",
        "ops/schemas/run-telemetry.schema.json",
        "runs/run-20260422-auto-improve-timeout-telemetry-fallback/baseline-lint.json",
        "runs/run-20260422-auto-improve-timeout-telemetry-fallback/baseline-eval.json",
        "runs/run-20260422-auto-improve-timeout-telemetry-fallback/baseline-mechanism-assessment.json",
        "runs/run-20260422-auto-improve-timeout-telemetry-fallback/candidate-lint.json",
        "runs/run-20260422-auto-improve-timeout-telemetry-fallback/candidate-eval.json",
        "runs/run-20260422-auto-improve-timeout-telemetry-fallback/candidate-mechanism-assessment.json",
        "runs/run-20260422-auto-improve-timeout-telemetry-fallback/changed-files-manifest.json",
        "runs/run-20260422-auto-improve-timeout-telemetry-fallback/behavior-delta.json",
        "runs/run-20260422-auto-improve-timeout-telemetry-fallback/improvement-observations.json",
        "runs/run-20260422-auto-improve-timeout-telemetry-fallback/promotion-report.json"
      ],
      "decision": "PROMOTE",
      "decision_event": {
        "decision_id": "decision:run-20260422-auto-improve-timeout-telemetry-fallback:4ebeb040f8167fe3",
        "decision": "PROMOTE",
        "reason_code": "no_blocking_rule_triggered",
        "policy_version": 4,
        "source_rule": "default_promote",
        "source_pass": "system_mechanism",
        "effective_at": "2026-04-22T12:55:33Z",
        "ledger_event_type": "promotion_evaluated"
      }
    },
    {
      "ts": "2026-04-22T12:55:33Z",
      "type": "finalized",
      "summary": "Recorded the finalized mechanism run in system-log and persisted the promotion report.",
      "artifacts": [
        "runs/run-20260422-auto-improve-timeout-telemetry-fallback/promotion-report.json",
        "runs/run-20260422-auto-improve-timeout-telemetry-fallback/run-ledger.json",
        "system/system-log.md"
      ],
      "decision": "complete",
      "decision_event": {
        "decision_id": "decision:run-20260422-auto-improve-timeout-telemetry-fallback:4ebeb040f8167fe3",
        "decision": "PROMOTE",
        "reason_code": "no_blocking_rule_triggered",
        "policy_version": 4,
        "source_rule": "default_promote",
        "source_pass": "system_mechanism",
        "effective_at": "2026-04-22T12:55:33Z",
        "ledger_event_type": "finalized"
      }
    }
  ],
  "metadata": {
    "properties": [
      {
        "name": "urn:openai:archived-run-backfill",
        "value": "{\"archive_reason\": \"run_artifact_embedded_envelope_backfill\", \"envelope_mode\": \"metadata.properties\", \"generated_at\": \"2026-04-22T12:55:33Z\", \"generated_at_source\": \"events[7].ts\", \"helper\": \"ops.scripts.backfill_archived_run_artifacts\", \"normalized_at\": \"2026-04-28T16:30:35Z\", \"source_artifact\": \"runs/run-20260422-auto-improve-timeout-telemetry-fallback/run-ledger.json\"}"
      },
      {
        "name": "urn:openai:artifact-envelope",
        "value": "{\"$schema\": \"ops/schemas/run-ledger.schema.json\", \"artifact_kind\": \"run_ledger\", \"artifact_status\": \"archived\", \"currentness\": {\"checked_at\": \"2026-04-28T16:30:35Z\", \"status\": \"current\"}, \"encoding\": \"utf-8\", \"generated_at\": \"2026-04-22T12:55:33Z\", \"input_fingerprints\": {\"archived_run_payload_before_backfill\": \"dda46f8566c3ee9be474b529388a3a63a228d3a058d5eef74a8f2c5bff72f7e6\", \"artifact_envelope_schema\": \"87fcb7b91ffc04e8180c1c3e51e309cde186ecf23f91f7974a541d0b580976de\", \"envelope_mode\": \"f9416f4de9dee1f94a28cfe3816ddf91a55b45560a990e9279c2582a6cf47e35\", \"generated_at_source\": \"751c5401cfdecc39a260bbfa3561f49b70611b741b498786c4c95c991152d633\", \"policy\": \"7d45acc617992bca127ce0b7defb6715caac5b774dcc489acf984502cea3a402\", \"schema\": \"c2cdb143ffa3afc0cc2983aceb7602caf13232ca806c6e02d3adfc4ce951c85a\", \"target_rel_path\": \"294af4c8b3a61a06968a830d7b672e6929b26f7270bd420af050b28c1cf742ac\"}, \"producer\": \"ops.scripts.backfill_archived_run_artifacts\", \"retention_policy\": \"archive\", \"schema_version\": 1, \"source_command\": \"python -m ops.scripts.backfill_archived_run_artifacts --vault . --path runs/run-20260422-auto-improve-timeout-telemetry-fallback/run-ledger.json\", \"source_revision\": \"unknown\", \"source_tree_fingerprint\": \"819b8f8fc8c653d5729dbfa7e445e23e571dee869f445d272c5cac58cb1accbf\"}"
      }
    ]
  }
}
