{
  "$schema": "ops/schemas/run-ledger.schema.json",
  "run_id": "run-20260507-auto-improve-iteration-persistence-typed-same-eval",
  "status": "ready",
  "events": [
    {
      "ts": "2026-05-06T19:12:47Z",
      "type": "created",
      "summary": "Initialized mechanism experiment artifacts from the mechanism-run starter bundle.",
      "artifacts": [
        "seed.yaml",
        "planning-validation.json",
        "run-ledger.json",
        "improvement-observations.json",
        "proposal-snapshot.json",
        "promotion-report.json",
        "plan.md",
        "open-questions.md",
        "baseline-eval.json",
        "candidate-eval.json",
        "baseline-lint.json",
        "candidate-lint.json",
        "baseline-mechanism-assessment.json",
        "candidate-mechanism-assessment.json",
        "changed-files-manifest.json"
      ],
      "decision": ""
    },
    {
      "ts": "2026-05-06T19:12:47Z",
      "type": "seed_frozen",
      "summary": "Frozen mechanism scope to primary target ops/scripts/auto_improve_iteration_persistence_runtime.py and prepared wrapper-driven execution.",
      "artifacts": [
        "runs/run-20260507-auto-improve-iteration-persistence-typed-same-eval/seed.yaml",
        "runs/run-20260507-auto-improve-iteration-persistence-typed-same-eval/plan.md",
        "runs/run-20260507-auto-improve-iteration-persistence-typed-same-eval/improvement-observations.json",
        "runs/run-20260507-auto-improve-iteration-persistence-typed-same-eval/promotion-report.json"
      ],
      "decision": "ready_for_baseline_capture"
    },
    {
      "ts": "2026-05-06T19:12:50Z",
      "type": "baseline_captured",
      "summary": "Captured baseline lint, eval, and mechanism assessment artifacts.",
      "artifacts": [
        "ops/scripts/auto_improve_iteration_persistence_runtime.py",
        "ops/schemas/run-telemetry.schema.json",
        "tests/test_auto_improve_iteration_runtime.py",
        "runs/run-20260507-auto-improve-iteration-persistence-typed-same-eval/baseline-lint.json",
        "runs/run-20260507-auto-improve-iteration-persistence-typed-same-eval/baseline-eval.json",
        "runs/run-20260507-auto-improve-iteration-persistence-typed-same-eval/baseline-mechanism-assessment.json"
      ],
      "decision": "baseline_ready"
    },
    {
      "ts": "2026-05-06T19:12:51Z",
      "type": "mutation_applied",
      "summary": "Applied the wrapper-provided mutation command inside a disposable workspace.",
      "artifacts": [
        "ops/scripts/auto_improve_iteration_persistence_runtime.py",
        "ops/schemas/run-telemetry.schema.json",
        "tests/test_auto_improve_iteration_runtime.py",
        "runs/run-20260507-auto-improve-iteration-persistence-typed-same-eval/mutation-command.stdout.txt",
        "runs/run-20260507-auto-improve-iteration-persistence-typed-same-eval/mutation-command.stderr.txt"
      ],
      "decision": "candidate_ready_for_capture"
    },
    {
      "ts": "2026-05-06T19:12:54Z",
      "type": "candidate_captured",
      "summary": "Captured candidate lint, eval, and mechanism assessment artifacts from the disposable workspace.",
      "artifacts": [
        "ops/scripts/auto_improve_iteration_persistence_runtime.py",
        "ops/schemas/run-telemetry.schema.json",
        "tests/test_auto_improve_iteration_runtime.py",
        "runs/run-20260507-auto-improve-iteration-persistence-typed-same-eval/candidate-lint.json",
        "runs/run-20260507-auto-improve-iteration-persistence-typed-same-eval/candidate-eval.json",
        "runs/run-20260507-auto-improve-iteration-persistence-typed-same-eval/candidate-mechanism-assessment.json"
      ],
      "decision": "ready_for_repo_health_gate"
    },
    {
      "ts": "2026-05-06T19:12:55Z",
      "type": "repo_health_checked",
      "summary": "Repo health command passed before promotion evaluation.",
      "artifacts": [
        "runs/run-20260507-auto-improve-iteration-persistence-typed-same-eval/repo-health.stdout.txt",
        "runs/run-20260507-auto-improve-iteration-persistence-typed-same-eval/repo-health.stderr.txt",
        "runs/run-20260507-auto-improve-iteration-persistence-typed-same-eval/changed-files-manifest.json",
        "runs/run-20260507-auto-improve-iteration-persistence-typed-same-eval/behavior-delta.json"
      ],
      "decision": "repo_health_pass"
    },
    {
      "ts": "2026-05-06T19:12:55Z",
      "type": "promotion_evaluated",
      "summary": "Promotion gate returned DISCARD for this mechanism run.",
      "artifacts": [
        "ops/scripts/auto_improve_iteration_persistence_runtime.py",
        "ops/schemas/run-telemetry.schema.json",
        "runs/run-20260507-auto-improve-iteration-persistence-typed-same-eval/baseline-lint.json",
        "runs/run-20260507-auto-improve-iteration-persistence-typed-same-eval/baseline-eval.json",
        "runs/run-20260507-auto-improve-iteration-persistence-typed-same-eval/baseline-mechanism-assessment.json",
        "runs/run-20260507-auto-improve-iteration-persistence-typed-same-eval/candidate-lint.json",
        "runs/run-20260507-auto-improve-iteration-persistence-typed-same-eval/candidate-eval.json",
        "runs/run-20260507-auto-improve-iteration-persistence-typed-same-eval/candidate-mechanism-assessment.json",
        "runs/run-20260507-auto-improve-iteration-persistence-typed-same-eval/changed-files-manifest.json",
        "runs/run-20260507-auto-improve-iteration-persistence-typed-same-eval/behavior-delta.json",
        "runs/run-20260507-auto-improve-iteration-persistence-typed-same-eval/improvement-observations.json",
        "runs/run-20260507-auto-improve-iteration-persistence-typed-same-eval/promotion-report.json"
      ],
      "decision": "DISCARD",
      "decision_event": {
        "decision_id": "decision:run-20260507-auto-improve-iteration-persistence-typed-same-eval:bdccf0259f1ab013",
        "decision": "DISCARD",
        "reason_code": "changed_files_manifest_primary_targets_touched",
        "policy_version": 4,
        "source_rule": "changed_files_manifest_primary_targets_touched",
        "source_pass": "system_mechanism",
        "effective_at": "2026-05-06T19:12:55Z",
        "ledger_event_type": "promotion_evaluated"
      }
    }
  ],
  "metadata": {
    "properties": [
      {
        "name": "urn:openai:archived-run-backfill",
        "value": "{\"archive_reason\": \"run_artifact_embedded_envelope_backfill\", \"envelope_mode\": \"metadata.properties\", \"generated_at\": \"2026-05-06T19:12:55Z\", \"generated_at_source\": \"events[5].ts\", \"helper\": \"ops.scripts.backfill_archived_run_artifacts\", \"normalized_at\": \"2026-05-06T19:22:10Z\", \"source_artifact\": \"runs/run-20260507-auto-improve-iteration-persistence-typed-same-eval/run-ledger.json\"}"
      },
      {
        "name": "urn:openai:artifact-envelope",
        "value": "{\"$schema\": \"ops/schemas/run-ledger.schema.json\", \"artifact_kind\": \"run_ledger\", \"artifact_status\": \"archived\", \"currentness\": {\"checked_at\": \"2026-05-06T19:22:10Z\", \"status\": \"current\"}, \"encoding\": \"utf-8\", \"generated_at\": \"2026-05-06T19:12:55Z\", \"input_fingerprints\": {\"archived_run_payload_before_backfill\": \"12256896d131c75ba6fa44e726fc8a4d38a23d16d465bcaa898c5fcd5962da95\", \"artifact_envelope_schema\": \"87fcb7b91ffc04e8180c1c3e51e309cde186ecf23f91f7974a541d0b580976de\", \"envelope_mode\": \"f9416f4de9dee1f94a28cfe3816ddf91a55b45560a990e9279c2582a6cf47e35\", \"generated_at_source\": \"07aad9f7baa9bbcb3aeb24081dc9d9faea73aa29949576fabfb311e0e73cf2d4\", \"policy\": \"606ba1235550f640f7365d46d76aa52b84ef8f831502790010a6c776a7b721d1\", \"schema\": \"c2cdb143ffa3afc0cc2983aceb7602caf13232ca806c6e02d3adfc4ce951c85a\", \"target_rel_path\": \"bd294328873a33b50acb7d656263a2c68da8b5c58b6e383ae47df55ec8c22660\"}, \"producer\": \"ops.scripts.backfill_archived_run_artifacts\", \"retention_policy\": \"archive\", \"schema_version\": 1, \"source_command\": \"python -m ops.scripts.backfill_archived_run_artifacts --vault . --path runs/run-20260507-auto-improve-iteration-persistence-typed-same-eval/run-ledger.json\", \"source_revision\": \"unknown\", \"source_tree_fingerprint\": \"33672f154e528ec9bc74e98544af631d9aa38e59088327a3bf31084ccaad1695\"}"
      }
    ]
  }
}
