{
  "$schema": "ops/schemas/run-ledger.schema.json",
  "run_id": "run-20260422-auto-improve-decision-record-fallback",
  "status": "running",
  "events": [
    {
      "ts": "2026-04-22T13:48:06Z",
      "type": "created",
      "summary": "Initialized mechanism experiment artifacts from the mechanism-run starter bundle.",
      "artifacts": [
        "seed.yaml",
        "planning-validation.json",
        "run-ledger.json",
        "improvement-observations.json",
        "promotion-report.json",
        "plan.md",
        "open-questions.md",
        "baseline-eval.json",
        "candidate-eval.json",
        "baseline-lint.json",
        "candidate-lint.json",
        "baseline-mechanism-assessment.json",
        "candidate-mechanism-assessment.json",
        "changed-files-manifest.json"
      ],
      "decision": ""
    },
    {
      "ts": "2026-04-22T13:48:06Z",
      "type": "seed_frozen",
      "summary": "Frozen mechanism scope to primary target ops/scripts/auto_improve_iteration_persistence_runtime.py and prepared wrapper-driven execution.",
      "artifacts": [
        "runs/run-20260422-auto-improve-decision-record-fallback/seed.yaml",
        "runs/run-20260422-auto-improve-decision-record-fallback/plan.md",
        "runs/run-20260422-auto-improve-decision-record-fallback/improvement-observations.json",
        "runs/run-20260422-auto-improve-decision-record-fallback/promotion-report.json"
      ],
      "decision": "ready_for_baseline_capture"
    },
    {
      "ts": "2026-04-22T13:49:34Z",
      "type": "baseline_captured",
      "summary": "Captured baseline lint, eval, and mechanism assessment artifacts.",
      "artifacts": [
        "ops/scripts/auto_improve_iteration_persistence_runtime.py",
        "ops/schemas/run-telemetry.schema.json",
        "tests/test_auto_improve_iteration_runtime.py",
        "runs/run-20260422-auto-improve-decision-record-fallback/baseline-lint.json",
        "runs/run-20260422-auto-improve-decision-record-fallback/baseline-eval.json",
        "runs/run-20260422-auto-improve-decision-record-fallback/baseline-mechanism-assessment.json"
      ],
      "decision": "baseline_ready"
    },
    {
      "ts": "2026-04-27T06:37:56Z",
      "type": "history_status_updated",
      "summary": "Marked mechanism run history as archived.",
      "artifacts": [
        "runs/run-20260422-auto-improve-decision-record-fallback/promotion-report.json",
        "runs/run-20260422-auto-improve-decision-record-fallback/run-ledger.json"
      ],
      "decision": "archived"
    }
  ],
  "metadata": {
    "properties": [
      {
        "name": "urn:openai:archived-run-backfill",
        "value": "{\"archive_reason\": \"run_artifact_embedded_envelope_backfill\", \"envelope_mode\": \"metadata.properties\", \"generated_at\": \"2026-04-27T06:37:56Z\", \"generated_at_source\": \"events[3].ts\", \"helper\": \"ops.scripts.backfill_archived_run_artifacts\", \"normalized_at\": \"2026-04-28T16:30:35Z\", \"source_artifact\": \"runs/run-20260422-auto-improve-decision-record-fallback/run-ledger.json\"}"
      },
      {
        "name": "urn:openai:artifact-envelope",
        "value": "{\"$schema\": \"ops/schemas/run-ledger.schema.json\", \"artifact_kind\": \"run_ledger\", \"artifact_status\": \"archived\", \"currentness\": {\"checked_at\": \"2026-04-28T16:30:35Z\", \"status\": \"current\"}, \"encoding\": \"utf-8\", \"generated_at\": \"2026-04-27T06:37:56Z\", \"input_fingerprints\": {\"archived_run_payload_before_backfill\": \"eeee673a8577923d6120b259fdc4f613a4f6705ff4a63e9f5ddc0d57870d3128\", \"artifact_envelope_schema\": \"87fcb7b91ffc04e8180c1c3e51e309cde186ecf23f91f7974a541d0b580976de\", \"envelope_mode\": \"f9416f4de9dee1f94a28cfe3816ddf91a55b45560a990e9279c2582a6cf47e35\", \"generated_at_source\": \"a15e287593bb86a3f90f399e002b8626a39702bf6354aaa8b3e5e53a9f230d01\", \"policy\": \"7d45acc617992bca127ce0b7defb6715caac5b774dcc489acf984502cea3a402\", \"schema\": \"c2cdb143ffa3afc0cc2983aceb7602caf13232ca806c6e02d3adfc4ce951c85a\", \"target_rel_path\": \"41f2dacb95591e47783159f90642e4a50146949752f16847905d0b7232b25cab\"}, \"producer\": \"ops.scripts.backfill_archived_run_artifacts\", \"retention_policy\": \"archive\", \"schema_version\": 1, \"source_command\": \"python -m ops.scripts.backfill_archived_run_artifacts --vault . --path runs/run-20260422-auto-improve-decision-record-fallback/run-ledger.json\", \"source_revision\": \"unknown\", \"source_tree_fingerprint\": \"819b8f8fc8c653d5729dbfa7e445e23e571dee869f445d272c5cac58cb1accbf\"}"
      }
    ]
  }
}
